{
	"$schema": "../board-definition.schema.json",
	"name": "Pi",
	"manufacturer": "Raspberry",
	"isHost": true,
	"serialPath": "/tmp/klipper_host_mcu",
	"firmwareBinaryName": "~/klipper/out/klipper.elf",
	"compileScript": "compile.sh",
	"flashScript": "flash.sh",
	"driverCount": 0,
	"documentationLink": "https://os.ratrig.com/docs/boards/pi"
}
