{
	"$schema": "../board-definition.schema.json",
	"name": "Cheetah v2",
	"manufacturer": "Fysetc",
	"serialPath": "/dev/fysetc-cheetah-v2",
	"firmwareBinaryName": "firmware-fysetc-cheetah-v2.bin",
	"compileScript": "compile.sh",
	"flashScript": "flash.sh",
	"driverCount": 4,
	"documentationLink": "https://os.ratrig.com/docs/boards/fysetc/cheetah-v2"
}
